title,content,url,date,source
午评：两市震荡 创业板指涨近1%,　　证券时报网 张一帆　　证券时报e公司讯，3月17日，两市高开后大幅震荡，创业板指盘中最大跌幅达3.3%，振幅达5.6%，至尾盘现快速拉升。截至午间收盘，沪指涨0.03%，深证成指涨0.18%，创业板指涨0.96%。盘面上，计算机、电力设备、券商板块涨幅居前，抗疫概念股回调，消费股低迷。资金面上，两市成交额约5550亿元，北向资金净流出超20亿元，但深港通现小幅净流入。责任编辑：马秋菊 SF186,https://finance.sina.com.cn/stock/jsy/2020-03-17/doc-iimxxstf9674257.shtml,2020年03月17日 11:50,新浪财经综合
泛华金融2019净利下滑四成 外贸信托为最大资金合作方,　　　3月16日，房抵贷服务提供商泛华金融（NYSE：CNF）发布2019年第四季度与2019年度未经审计的财务报告。　　2019年度泛华金融实现净利润5.35亿元，与2018年同期的8.61亿元相比减少37.9%。实现利息和费用总收入29.7亿元，同比减少30.8%，其中贷款利息和融资服务费为29.53亿元，同比减少31%；银行存款利息收入为1670万元，同比增长20.1%。　　泛华金融的业绩下滑主要是由于其贷款发放数量的减少，2019年泛华金融共发放贷款63亿元，同比减少33.7%，截至2019年12月31日，未偿还贷款本金余额为113亿元，较2018年末的借贷余额158亿元相比减少28.5%。同时，活跃借款人显著减少，截至2019年12月31日，活跃借款人总数为2.5万人，较2018年末的3.1万人减少18.6%。　　资金来源方面，目前泛华金融仍通过信托公司获取资金，中国对外经济贸易信托公司（FOTIC）为其最大合作伙伴。尽管泛华金融未披露目前来自信托的资金占比，但从此前发布的招股书来看，2018年上半年，信托公司提供的资金总额合计163亿元，占泛华金融同期发放贷款总额的99.8%。　　值得一提的是，在泛华金融上市前，还曾通过旗下P2P平台淘淘金获取资金，不过泛华金融董事长兼CEO翟彬曾接受媒体采访表示，“淘淘金以前是和我们合作的，为我们提供资金。自从监管严格之后，泛华金融就主要是和信托公司合作了。” 淘淘金法定代表人及第二大股东钟和平目前仍在北京泛华小额贷款有限公司任监事，还曾任职于深圳泛华小额贷款有限公司、深圳泛华联合投资集团有限公司。上述三家公司法定代表人均为翟彬，股东股权穿透后为泛华金融。2019年9月，深圳市地方金融监督管理局公布第三批自愿退出且声明网贷业务已结清网贷机构名单，淘淘金在列。　　在财报中，泛华金融表示，公司已将战略重点从贷款增长转移到确保贷款质量。截至2019年12月31日，泛华金融贷款逾期率为5.4%，较2014年末的7.6%有所减少，而据此前招股书披露，截至2016年12月31日、2017年12月31日、2018年6月30日，泛华金融的贷款逾期率分别为5.38%、7.17%、11.49%。　　泛华金融2019年计提的信贷损失准备金为3.63亿元，与2018年的4.34亿元相比减少16.36%。泛华金融表示，信贷损失准备的减少一方面是由于逾期贷款减少，另一方面是在新的协作模式下，其销售合作伙伴提供了信用风险缓释工具作为贷款担保。　　2019年泛华金融开始推行合伙人平台模式，即引入贷款经纪机构参与销售，该年度支付给销售合伙人的奖励为1.74亿元，仅第四季度的3个月内，泛华金融对销售合作伙伴的奖励就高达7580万元。截至2019年12月31日，泛华金融已与约1300个销售合作伙伴签约，通过其中约700家发放贷款，第四季度通过合伙人模式发放的贷款达到20亿元。公开报道显示，泛华金融的签约合伙企业与意向战略合伙企业包括龙顺物业、华融通达、和元信业、百团物业、中汇盛世、长安融通等。　　蓝鲸财经注意到，长安融通全名为长安融通资产管理有限公司，官网介绍其由长安国际信托股份有限公司与思普瑞设计咨询有限公司共同出资设立，思普瑞设计持股60%为第一大股东，长安国际信托持股40%。但就在2019年12月，长安国际信托已退出长安融通股东名单，而长安融通官网仍显示其为国企背景。　　此外，2020年1月8日，思普瑞设计将其持有的长安融通60%股份全部出质给西安投资控股有限公司。长安融通目前主要有融房保、橙消费教育品牌联盟等两个产品，其中，融房保系为房抵贷项目提供金融咨询服务，橙消费则是针对K12教培机构提供聚合支付、分期付款、招生引流、教务管理等服务。责任编辑：潘翘楚 ,https://finance.sina.com.cn/money/bank/bank_hydt/2020-03-17/doc-iimxxstf9690746.shtml,2020年03月17日 12:55,蓝鲸财经
交行连平转战中植系 加盟新湖财富服务私人银行业务,　　　3月17日，据界面新闻记者了解，原首席经济学家连平近日正式加盟“中植系”旗下新湖财富，担任研究院院长兼植信投资首席经济学家。　　新湖财富官网信息　　连平是国内知名经济学家，在从华东师范大学毕业后，连平一直在华东师范大学体系内任职，最高升至华东师范大学国际商学院副院长，远东国际金融学院院长。　　1998年起，连平开始在交通银行总行工作，曾任发展研究部副总经理、组织架构再造办公室主任。在此番工作变动前，连平是交通银行的首席经济学家。另外，连平还兼任业协会行业发展研究委员会主任、中国首席经济学家论坛理事长、国家金融与发展实验室理事等社会职位。　　此次职务变动另一边的新湖财富则是“中植系”旗下五大财富管理公司之一，从事第三方高端综合金融服务的私人银行业务。　　公开信息显示，中植财富控股有限公司持有新湖财富47.03%的股份。浙江新湖集团股份有限公司持股17.08%，以及持股8.16%，其余为高管及员工通过名字开头为江阴的四家投资公司的持股。“中植系”实际控制人解直锟持有中植财富控股有限公司100%的股权，并持有少量江阴公司的股权，股权穿透后解直锟个人持有新湖财富的股份为49.39%。　　连平具体加入的是新湖财富所属的应用性专业研究机构――植信投资研究院。据悉，该研究院今年3月刚刚成立，连平任研究院首任院长，兼植信投资首席经济学家。　　新湖财富方面表示，设置植信投资研究院，布局专业研究，是公司私人银行业务建设的一部分。　　据悉，新成立的植信投资研究院将下设宏观经济、资产配置和财富管理三大研究中心。其中宏观经济研究中心负责分析需求与供给、产业和就业等宏观经济运行态势，研判宏观政策包括财政政策和货币政策的发展变化及其趋势，为资产配置策略提供方向基础和实施条件；资产配置研究中心，则在宏观经济研究的基础上，分析主要行业和大宗商品的市场运行格局和趋势，为客户提供科学的资产配置建议和方案；财富管理研究中心分析研究财富管理行业运行变化、产业模式、监管政策、客户行为及结构等内容，为市场营销、业务创新和经营策略提供良好建议和可行方案。责任编辑：潘翘楚 ,https://finance.sina.com.cn/roll/2020-03-17/doc-iimxxstf9691338.shtml,2020年03月17日 12:56,界面新闻
全国首例！1人隐瞒病情900人隔离，判了,　　原标题：全国首例！1人隐瞒病情900人隔离，判了　　1月31日，青海警方发布的一纸通报引发广泛关注：从武汉回乡的苟某刻意隐瞒发热症状和行程，不仅自己和儿子感染，还造成900余人被隔离，被公安机关立案侦查。　　长安街知事注意到，这是疫情期间青海，乃至全国首例妨害传染病防治案件。今天上午，苟某被判处有期徒刑一年，当庭表示不上诉。　　苟某是西宁市湟中县李家山镇汉水沟村村民，长期在武汉经营兰州拉面馆。　　1月16日，他乘坐火车从武汉离开，次日19时到达西宁，乘同村村民私家车返回家中；　　1月18日傍晚，苟某至西宁市城东区探望其弟并留宿；　　1月19日，苟某以感冒为由到村卫生室就诊，被问及返宁时间，谎称已40余天；　　期间，苟某不主动居家隔离，随意走亲访友；　　1月23日，村委会要求武汉返宁人员登记，苟某未按要求做；　　1月25日晚，面对医护人员及村干部，苟某仍谎称回家已40余天，车票已撕毁；　　1月27日，自感身体不适，苟某在其妹等亲属陪同下，到青海红十字医院就诊，诊断为疑似病例；　　1月30日，确诊。　　简而言之，他造成村民在内的共900余人整体隔离，密切接触人员中3人被确诊并住院治疗。　　故意隐瞒真实行程，刻意隐瞒已有发热咳嗽等症状，欺骗调查走访人员，多次主动与周边人群密切接触……更加恶劣的是，苟某有意隐瞒其子与其一同从武汉返回的事实，其子也多次在外活动，并密切接触人群。　　确诊次日，即1月31日，苟某因涉嫌以危险方法危害公共安全罪，被西宁市公安局立案侦查。　　检察机关介入后认为，苟某对自己已感染新冠肺炎并不知情，拒绝执行卫生防疫机构依照传染病防治法提出的防控措施，引起新型冠状病毒传播或者有传播严重危险的行为，符合刑法第三百三十三条妨害传染病防治罪的构成要件，应认定为妨害传染病防治罪。　　经治疗，苟某治愈出院。3月9日，湟中县检察院以妨害传染病防治罪，对其提起公诉。　　法院经审理认为，国家宣布对新冠肺炎采取甲类传染病预防、控制措施后，苟某拒绝执行预防、控制措施，引起病毒传播危险，已构成妨害传染病防治罪。　　鉴于他归案后如实供述所犯罪行，认罪认罚，并签署认罪认罚具结书，可依法从轻处罚，遂当庭判处其有期徒刑一年。宣判后，苟某当庭表示服判不上诉。责任编辑：杨杰 ,https://news.sina.com.cn/c/2020-03-17/doc-iimxxstf9722679.shtml,2020年03月17日 15:15,北京日报客户端
全球战疫日报:多国紧急闭关 特朗普称美国可能经济衰退,　　原标题：全球战疫日报丨多国紧急闭关，特朗普称美国可能经济衰退　　一图看懂每日全球战“疫”大事责任编辑：李昂 ,https://finance.sina.com.cn/world/gjcj/2020-03-17/doc-iimxxstf9699157.shtml,2020年03月17日 13:24,第一财经
国产14种检测试剂盒已向11个国家供货,　　原标题：国产14种检测试剂盒已向11个国家供货　　教育部科技司司长雷朝滋介绍，在保障我国检测需要基础上，我国的病毒检测试剂已经走出国门，我国多所高校研发14种新冠病毒检测试剂盒进入欧盟市场，向意大利、英国、荷兰等11个国家供货。责任编辑：杨杰 ,https://news.sina.com.cn/c/2020-03-17/doc-iimxyqwa1161233.shtml,2020年03月17日 15:28,人民日报
"延安必康口罩洗手液产能达原定要求 曾两次被""警告""",　　原标题：口罩、洗手液产能达原定要求 曾两次被“警告”　　新京报讯（记者 王卡拉）3月17日，延安必康发布公告，截至3月17日，公司口罩生产线改建项目和洗手液生产线改建项目的产能已达到原定规划要求，其中，口罩产能为32万只/日，洗手液产能为300万瓶/年。　　2月4日，延安必康发布公告，应政府要求，为解决医用口罩生产供应严重不足问题，公司将尽快组织资源完成生产线改造，加快口罩等疫控防护品生产。3月17日发布的最新进展显示，必康新沂口罩机供应商广东昱升及富田精工提供和交付的2台口罩机已完成组装调试，开展生产工作，口罩产能32万只/日，已达到原定规划产能目标。　　必康新沂医用口罩生产资质的认证工作正在有序推进中，申报材料已被江苏省药品监督管理局受理，医用口罩样品已送检，目前尚未进入现场检查阶段。必康新沂在正式获取医用口罩生产相关资质前，将按照相关标准生产民用版防护口罩。3月13日，必康新沂收到第三方检测机构对其生产的一次性使用防护口罩质量检测合格的报告，可以正常生产、销售民用版防护口罩。　　另外，3月4日和3月12日，延安必康分别取得了《消毒产品生产企业卫生许可证》及产品检测合格的报告，洗手液生产线改造项目已建设完成，产能已达到原定规划目标300万瓶/年。延安必康表示，待完成全国消毒产品网上备案后即可正常生产、销售。　　此次疫情期间，由于在披露新增口罩生产线、新增战略合作中提及与疫情相关药物时的信息披露不完整，延安必康先后收到了深交所的监管函和陕西证监局的警示函。其中，3月11日陕西证监局下发的警示函显示，延安必康2月5日发布的公告中未披露公司尚不存在口罩生产业务、尚未取得相关资质等对股价可能产生重大影响的信息，经督促后才于2月6日补充披露并提示风险。　　2月7日，公司又在披露与图微安创成为战略伙伴的公告中称，图微安创已经开发出了“对肺纤维化具有良好治疗逆转作用的多肽药物，相关生物指标逆转在80%以上，属于全球首创，未来有望成为治疗肺纤维化领域的明星药物”等内容，但未明确说明作出上述判断的依据，未对相关药物研制的时间过程、后续研发、审批程序等重要信息进行披露，未客观披露产品情况，且未进行风险提示，存在信息披露不完整、不准确的情形。经督促，延安必康才于2月11日补充披露。根据其披露内容，上述药物预计要到2021年才完成临床前开发，2022年第一季度申报临床试验。同时，延安必康称，双方尚未对具体合作内容达成正式协议。　　陕西证监局认为，上述事项违反了相关规定，谷晓嘉、香兴福、苏熳作为延安必康时任董事长、总经理、董事会秘书，对上述信息披露问题负有主要责任，决定对上述人员及公司采取出具警示函的监管措施。　　2月5日延安必康披露新增口罩生产线后，公司股价连续两日涨停，2月7日高开后回落，收于15.93元/股。3月12日公司发布关于收到陕西证监局警示函的公告后，股价持续下跌，截至3月17日午间收盘，股价收于10.82元/股，下跌2.96%。责任编辑：赵慧芳 ,https://finance.sina.com.cn/roll/2020-03-17/doc-iimxxstf9705606.shtml,2020年03月17日 13:50,新京报网
豆粕大涨多头狂欢 上车机会or割韭镰刀？,　　来源：交易法门　　　　最近两个交易日，豆粕盘面开始了上涨，市场上豆粕多头的热情又出来了。不过市场似乎反应总是慢半拍，之前豆粕基差大涨的时候，盘面表现得比较平静，现在又开始了连续两个交易日的大涨。我打算按照美豆、国内沿海、豆粕、交易的顺序简单地谈一下我对豆粕以及交易的一些看法。　　　　要说豆粕，不得不先说美豆的情况。美豆由于贸易摩擦的影响处于低位，今年又由于巴西丰产以及雷亚尔走弱，始终保持低位运行，美豆跌，雷亚尔就贬值，一个跌到低位，一个贬到低位，美豆和巴豆争夺出口份额。不过好在阿根廷增加了出口关税，对美豆出口有一定的利好支撑。　　从目前美豆盘面来看，价格已经处于比较低的位置了，从 2007 年以来美豆很少能跌破 800 美分，基本上 800 美分可以作为一个非常重要的支撑位置，所以美豆现在是处于低估状态的，做豆粕基本不用怕美豆再往下大幅下跌。　　（来源：博易大师）　　　　谈完美豆，我们再来看一下国内压榨的原料大豆情况，因为从沿海大豆库存的多少可以看出目前国内压榨是否缺豆，如果缺豆，很多压榨企业则可能被迫停机，从而对油粕来说都是利好，因为供应端压力减轻了。　　豆粕的大涨从上周五开始，市场传闻巴西那边疫情严重，大豆出口可能受影响，也有传闻说大豆到港无法卸货等等，总之来说，市场炒作的是供应端的问题，即进口不足，国内缺豆，压榨被迫下降。　　（来源：天下粮仓）　　这一点从国内沿海大豆库存可以看出，确实是历史同期低位，与此同时，压榨也是历史同期低位。另外市场也有传闻，某地区的一些压榨企业由于缺豆，被迫停机半个月。所以我的理解是市场依然在炒作供应端的利好。　　此外，如果是需求端发生利好，那么粕和油一般都是跷跷板效应，而今天明显是油粕一起涨，说明有共性的利多，那就是供应端由于缺豆，压榨被迫停机，供应压力缓解。　　（来源：天下粮仓）　　　　接着再来谈谈豆粕自身的情况，上面简单地介绍了供应端的一些情况，我们再来看一下豆粕需求的情况，最近豆粕的成交也是相对回暖了一些，而且有一个明星的特点是基差已经开始大幅走强，之前油是很高的基差，粕是负基差，现在粕的基差走强，油的基差走弱，现在油粕的基差格局反过来了，有可能反映了油厂挺粕弃油的态度。　　（来源：天下粮仓）　　另外，之前一直担心的非洲猪瘟影响需求的问题，似乎不知不觉消失了。据农业农村部监测，能繁母猪存栏连续5个月恢复增长，市场供应积极向好。目前全国生猪养殖上下游企业产能恢复提速，饲料企业复工率超过七成。此外还有各种的养猪补贴，甚至是养猪主题的债券发行。　　当然，豆粕自身目前处于低库存状态，库存水平是最近几年以来历史同期最低位，而且由于近期进口大豆减少，部分油厂因为缺豆而被迫停机，所以低库存的情况下，再遇到供应端收紧，盘面上价格的弹性就比较大，尤其是近月合约，会更加放大这种波动。　　（来源：天下粮仓）　　上面这些说的都是利多的现实以及利多的预期，接下来谈两点需要注意的风险。第一，目前巴西大豆的盘面榨利还是不错的，因为油厂一般不追求超额利润，而是有自己的目标利润管理，基本上给出一定的榨利，都会在盘面锁定利润，所以这个对远月合约其实还是偏不利的，尤其是在国内豆粕上涨，但是美豆没涨的情况下，这个就会扩大盘面榨利，更容易吸引油厂卖出套保。　　当然，市场上也许有人不担心盘面榨利的问题，主要是因为阿根廷提高了大豆出口关税，巴西那边因为疫情影响，可能无法向外出口大豆，所以有人认为即使盘面有较高的榨利，你想套保，你得有豆子进来。我只是从风险的角度提示一下，现在缺豆，下个月未必缺豆，豆子进来的可能性远大于进不来的可能性。　　第二，看多豆粕的人太多了，大家都在看多和做多豆粕，从市场博弈的角度来说，市场永远是少数人赚多数人的钱，当大家都看多的时候，往往大家都不赚钱，直到看多的人悲观绝望，慢慢不怎么谈豆粕了，市场往往开始真正上涨。所以我今天说完之后，一年都不再谈豆粕了，我只是观察着现货和盘面的变化，关注着市场谈论豆粕的情绪。只要这种浓浓的看多氛围迟迟不去，豆粕就不容易大涨，就会一直在那里耗损你的耐心。　　　　如果你是做长期投资，你认为美豆和豆粕这个价格都是低估了的，你选择择价就可以了，不需要知道它为什么上涨，要么是供应端什么原因导致美豆估值修复，从而使得豆粕估值跟着修复；要么是需求端生猪产能恢复，需求拉动豆粕估值恢复，进而带动美豆估值修复；甚至是没有任何理由和原因，在价值规律的作用下，美豆和豆粕自然发生估值修复。如果你是做短线的，盘面涨了，给你图形了，干就行了，图形坏了，扯就行了。　　（来源：博易大师）　　从 M2009 合约来看，最近两次都在试图突破趋势线来打破原有的趋势，第一次是假突破，跌下来了，短短时间又一次去突破趋势线，今天又留下了一根长影响，当然现在还没收盘，不确定收盘结果情况。总之在这个位置上，比较敏感，乐观之处在于，短期连续挑战趋势线，说明市场对你之前的趋势反抗越来越强烈，悲观之处在于，连着两次都遭遇了打压，说明市场的阻力还是不小的，这种阻力来自于什么？可能就是盘面榨利！责任编辑：陈修龙 ,https://finance.sina.com.cn/money/future/fmnews/2020-03-17/doc-iimxyqwa1140898.shtml,2020年03月17日 13:51,新浪财经-自媒体综合
贵阳市发现一例境外输入新冠肺炎无症状感染病例,　　原标题：贵阳市发现一例境外输入新冠肺炎无症状感染病例　　新华社贵阳3月17日电（记者肖艳）17日，贵州省应对新冠肺炎疫情防控领导小组办公室发布消息称，3月16日，贵阳市发现一例境外输入新冠肺炎无症状感染病例。　　据悉，这名无症状感染者向某（男，20岁，学生）为境外返贵阳人员，由伦敦经香港转机到成都后乘坐高铁，于3月15日23时43分到达贵阳北站，由其父母驾私家车接回家中实行居家隔离观察。16日下午，成都海关通报贵阳海关向某核酸检测为阳性后，相关部门立即采取措施，于当日19时28分将向某转入将军山医院进一步检测和治疗。同时，对向某父母等密切接触者采取了隔离措施，并进行相关检测，核酸检测结果为阴性。向某所居住的贵阳市南明区“在水一方”小区相关区域，疾控部门已按相关规定进行了消毒。　　结合向某无发热、无呼吸道症状、血常规正常、胸部CT为陈旧性病变，以及疾控部门核酸检测阳性，经省级专家组讨论，确认向某为无症状感染者。目前向某情况平稳。责任编辑：刘万里 SF014,https://finance.sina.com.cn/roll/2020-03-17/doc-iimxxstf9711370.shtml,2020年03月17日 14:21,新华社
冲高回落 沪指跌逾1%,　　中国证券网　　3月17日午后，三大股指冲高回落。截至14：08，上证指数报2756.05点，下跌33.2点，跌1.19%，成交额2746.72亿元；深证成指报10094.44点，下跌158.84点，跌1.55%，成交额4247.33亿元，两市合计成交额6994.05亿元；创业板指报1894.64点，下跌16.13点，跌0.84%，成交额1435.86亿元。　　盘面上看，行业板块普遍飘绿，其中计算机、电气设备等板块涨幅领先，纺织服装、食品饮料、家用电器板块跌幅居前。两市个股跌多涨少，共计778只个股上涨，2651只个股下跌。责任编辑：马秋菊 SF186,https://finance.sina.com.cn/stock/jsy/2020-03-17/doc-iimxyqwa1146700.shtml,2020年03月17日 14:21,中国证券网
